{"blobs":[{"digest":"sha256:1bee26b045e7c90d616405bb6d173a2db22b6d3f2851d02242e5adccda41cbff","hints":[],"size_bytes":423},{"digest":"sha256:a9c749023a1e0b8273c13317c591f974e4df6c9c2fc861865840e138e13d7b28","hints":[],"size_bytes":480},{"digest":"sha256:c8ff7cde6f7617c7cb9bf18aec92845fce519ab74018887c7fc9ab8ab5033145","hints":[{"url":"https://cdn.example.com/blobs/word-timeline.json"}],"size_bytes":8124}],"extensions":{},"profile":"hybrid","release_id":"sha256:8a8e6d71c667273ff537a95aea838a25b00621af0f7dab360a98a341ea8a835c","schema":"listen.content-package.delivery.v2"}