{"blobs":[{"digest":"sha256:29ecf0e48149f3706ded9e9ea048df6635f977b55e20ecb29365e810cf58fbb9","hints":[],"size_bytes":444},{"digest":"sha256:db868bc797d3b618d49c1855c1d893186288a4c0586e3dedfe1a3ce230fbd390","hints":[{"url":"https://cdn.example.com/audio/museum-tour.mp3"}],"size_bytes":3291402}],"extensions":{},"profile":"hybrid","release_id":"sha256:e188fd643b969b2c1405428018af962faec18c25252ceddaa468c2d3c049b0b5","schema":"listen.content-package.delivery.v2"}